<?xml version="1.0" encoding="windows-1251"?>

<operations-config xmlns:xsi="http://www.w3.org/2001/XMLSchema-instance" xsi:noNamespaceSchemaLocation="../../schemas/operations.xsd">

	<resources>
		<resource key="ActivePerson" name="Пользователь"
		          class="com.rssl.phizic.business.persons.ActivePerson"/>
		<resource key="AccessScheme" name="Схема доступа"
		          class="com.rssl.phizic.business.schemes.SharedAccessScheme"/>
		<resource key="AccountLink" name="Счет"
		          class="com.rssl.phizic.business.resources.external.AccountLink"/>
		<resource key="CardLink" name="Карта" class="com.rssl.phizic.business.resources.external.CardLink"/>
	</resources>

	<operations>

		<!-- !!! Для пользователя !!! -->

				<!-- Общие -->
		<!-- Сокрытие курса валют -->
		<operation key="ShowCurrenciesRateOperation"
		           name="Доступ к курсам валют"
		           class="com.rssl.phizic.operations.currency.ShowCurrenciesRateOperation"
		           tag="client">
		</operation>

		<!-- Просмотр журнала последних операций -->
		<operation key="GetLastUserLogEntriesOperation"
		           name="Получение информации о последних операциях клиента"
		           class="com.rssl.phizic.operations.log.GetLastUserLogEntriesOperation"
		           tag="client">
		</operation>

		<!-- Печать мемориального ордера -->
		<operation key="PrintMemOperation"
		           name="Печать платежного поручения"
		           class="com.rssl.phizic.operations.payment.PrintMemOperation"
		           tag="client">
		</operation>

		<!-- Операции со счетами -->
		<operation key="GetAccountsOperation"
		           name="Доступ к списку счетов"
		           class="com.rssl.phizic.operations.account.GetAccountsOperation"
		           tag="client">
			<restriction interface="com.rssl.phizic.business.resources.external.AccountFilter"
			             default="com.rssl.phizic.business.resources.external.NullAccountFilter"/>
		</operation>

		<operation key="GetAccountAbstractOperation"
		           name="Получение выписки по счету"
		           class="com.rssl.phizic.operations.account.GetAccountAbstractOperation"
		           tag="client">
			<restriction interface="com.rssl.phizic.business.resources.external.AccountFilter"
			             default="com.rssl.phizic.business.resources.external.NullAccountFilter"/>
		</operation>

		<operation key="ShowLongOfferOperation"
		           name="Отчет об исполнении длительных поручений"
		           class="com.rssl.phizic.operations.account.ShowLongOfferOperation"
		           tag="client">
		</operation>

		<operation key="GetAccountInfoOperation"
		           name="Получение информации по счёту"
		           class="com.rssl.phizic.operations.account.GetAccountInfoOperation"
		           tag="client">
		</operation>

		<operation key="AccountInfoPrintOperation"
		           name="Печать информации о счете"
		           class="com.rssl.phizic.operations.print.AccountInfoPrintOperation"
		           tag="client"/>

		<!-- Операции с картами -->
		<operation key="GetCardsOperation"
		           name="Доступ к списку карт"
		           class="com.rssl.phizic.operations.card.GetCardsOperation"
		           tag="client">
			<restriction interface="com.rssl.phizic.business.operations.restrictions.CardRestriction"
			             default="com.rssl.phizic.business.operations.restrictions.defaults.NullCardRestriction"/>
		</operation>

		<operation key="GetCardAbstractOperation"
		           name="Получение выписки по карте"
		           class="com.rssl.phizic.operations.card.GetCardAbstractOperation"
		           tag="client">
			<restriction interface="com.rssl.phizic.business.operations.restrictions.CardRestriction"
			             default="com.rssl.phizic.business.operations.restrictions.defaults.NullCardRestriction"/>
		</operation>

		<operation key="GetCardInfoOperation"
		           name="Получение информации по картам"
		           class="com.rssl.phizic.operations.card.GetCardInfoOperation"
		           tag="client">
			<restriction interface="com.rssl.phizic.business.operations.restrictions.CardRestriction"
			             default="com.rssl.phizic.business.operations.restrictions.defaults.NullCardRestriction"/>
		</operation>

		<operation key="CardInfoPrintOperation"
		           name="Печать информации о счете"
		           class="com.rssl.phizic.operations.card.GetCardInfoOperation"
		           tag="client">
			<restriction interface="com.rssl.phizic.business.operations.restrictions.CardRestriction"
			             default="com.rssl.phizic.business.operations.restrictions.defaults.NullCardRestriction"/>
		</operation>

		<!-- Операции с формами платежей -->
		<operation key="CreateFormPaymentOperation"
		           name="Создание платежа"
		           class="com.rssl.phizic.operations.payment.CreateFormPaymentOperation"
		           tag="client"/>

		<operation key="CreateFormPaymentGuidOperation"
		           name="Создание платежа (guid for anonymous)"
		           class="com.rssl.phizic.operations.payment.CreateFormPaymentGuidOperation"
		           tag="client"/>

		<operation key="ConfirmFormPaymentOperation"
		           name="Подтверждение платежа"
		           class="com.rssl.phizic.operations.payment.ConfirmFormPaymentOperation"
		           tag="client"/>

		<operation key="ViewDocumentOperation"
		           name="Просмотр/печать документа"
		           class="com.rssl.phizic.operations.forms.ViewDocumentOperation"
		           tag="client"/>

		<operation key="GetMetaPaymentListOperation"
		           name="Список платежей на основе формы"
		           class="com.rssl.phizic.operations.payment.GetMetaPaymentListOperation"
		           tag="client"/>

		<!-- Операции c депозитами -->
		<operation key="GetDepositProductsListOperation"
		           name="Список депозитных продуктов"
		           class="com.rssl.phizic.operations.deposits.GetDepositProductsListOperation"
		           tag="client">
			<restriction
					interface="com.rssl.phizic.business.operations.restrictions.DepositProductRestriction"
					default="com.rssl.phizic.business.operations.restrictions.defaults.PersonDepartmentDepositProductRestriction"/>
		</operation>

		<operation key="GetDepositListOperation"
		           name="Список депозитов (вкладов) клиента"
		           class="com.rssl.phizic.operations.deposits.GetDepositListOperation"
		           tag="client"/>

		<operation key="DepositDetailsOperation"
		           name="Полная информация о депозитном продукте"
		           class="com.rssl.phizic.operations.deposits.DepositDetailsOperation"
		           tag="general">
			<restriction
					interface="com.rssl.phizic.business.operations.restrictions.DepositProductRestriction"
					default="com.rssl.phizic.business.operations.restrictions.defaults.PersonDepartmentDepositProductRestriction"/>
		</operation>

		<operation key="DepositCalculatorOperation"
		           name="Калькулятор депозитных продуктов"
		           class="com.rssl.phizic.operations.deposits.DepositCalculatorOperation"
		           tag="client">
			<restriction
					interface="com.rssl.phizic.business.operations.restrictions.DepositProductRestriction"
					default="com.rssl.phizic.business.operations.restrictions.defaults.PersonDepartmentDepositProductRestriction"/>
		</operation>

		<operation key="GetDepositInfoOperation"
		           name="Получение информации по вкладу"
		           class="com.rssl.phizic.operations.deposits.GetDepositInfoOperation"
		           tag="client">
		</operation>

		<operation key="GetDepositAbstractOperation"
		           name="Получение выписки по вкладу"
		           class="com.rssl.phizic.operations.deposits.GetDepositAbstractOperation"
		           tag="client">
			<restriction interface="com.rssl.phizic.business.operations.restrictions.DepositProductRestriction"
			             default="com.rssl.phizic.business.operations.restrictions.defaults.PersonDepartmentDepositProductRestriction"/>
		</operation>

		<operation key="DepositInfoPrintOperation"
		           name="Печать информации о депозите"
		           class="com.rssl.phizic.operations.print.DepositInfoPrintOperation"
		           tag="client"/>

		<!--Операции с кредитами -->
		<operation key="GetLoanProductListOperation"
				   name="Список кредитных продуктов банка"
				   class="com.rssl.phizic.operations.loans.products.GetLoanProductListOperation"
				   tag="client">
			<restriction
					interface="com.rssl.phizic.business.operations.restrictions.LoanProductRestriction"
					default="com.rssl.phizic.business.operations.restrictions.defaults.NullLoanProductRestriction"/>
		</operation>

		<operation key="LoanProductDetailsOperation"
		           name="Полная информация о кредитном продукте"
		           class="com.rssl.phizic.operations.loans.products.LoanProductDetailsOperation"
		           tag="client">
			<restriction
					interface="com.rssl.phizic.business.operations.restrictions.LoanProductRestriction"
					default="com.rssl.phizic.business.operations.restrictions.defaults.NullLoanProductRestriction"/>
		</operation>

		<operation key="LoanCalculatorOperation"
		           name="Калькулятор кредитных продуктов"
		           class="com.rssl.phizic.operations.loans.LoanCalculatorOperation"
		           tag="client">
			<restriction
					interface="com.rssl.phizic.business.operations.restrictions.LoanProductRestriction"
					default="com.rssl.phizic.business.operations.restrictions.defaults.NullLoanProductRestriction"/>
		</operation>

		<operation key="GetLoanListOperation"
				   name="Список кредитов клиента"
				   class="com.rssl.phizic.operations.loans.loan.GetLoanListOperation"
				   tag="client"/>

		<operation key="GetLoanInfoOperation"
		           name="Получение информации по кредиту"
		           class="com.rssl.phizic.operations.loans.loan.GetLoanInfoOperation"
		           tag="client">
			<restriction
					interface="com.rssl.phizic.business.operations.restrictions.LoanRestriction"